{
  "event_id": "10000000-0000-4000-8000-000000000201",
  "event_type": "course.version.submitted.v1",
  "event_version": 1,
  "producer": "courses",
  "tenant_id": "00000000-0000-4000-8000-0000000000a1",
  "aggregate_type": "course_version",
  "aggregate_id": "00000000-0000-4000-8000-00000000c101",
  "aggregate_version": 4,
  "occurred_at": "2026-08-18T00:00:00Z",
  "recorded_at": "2026-08-18T00:00:01Z",
  "correlation_id": "30000000-0000-4000-8000-000000000201",
  "causation_id": "40000000-0000-4000-8000-000000000201",
  "privacy_class": "internal",
  "payload": {
    "course_id": "00000000-0000-4000-8000-00000000c001",
    "course_version_id": "00000000-0000-4000-8000-00000000c101",
    "content_hash": "sha256:f4e7e98f5fe8199a25ba5293d4a7a58e1f45b649941de8c0935282ae5845ec31",
    "aggregate_version": 4
  }
}
